374789201,Photo,Bobolink,Dolichonyx oryzivorus,Sturnella neglecta -- Western Meadowlark,Sharon J,2021-10-03,2021,10,3,1336,United States,US-CA-075,California,San Francisco,Presidio--Crissy Field,37.8041273,-122.4642633,"",,Unspecified,"","",,,,,,,S95559303,"",,,,"Continuing, found by Brian Fitch on the first. Like if a WEME and WCSP somehow had a baby. Generally light brown and streaky above, yellow-buff breast and supercilium, strong crown stripes, white in center, dark brown super-supercilium and post-ocular line. Short (like cowbird) pinkish bill. Much smaller than WEME it was associating with. Did not show white outer tail feathers in flight. Flock flushed repeatedly, but eventually decently seen 37.803586,-122.462309",Dolichonyx oryzivorus,boboli,Species,32470,,2.00,1,,1133,1600
374785861,Photo,Bobolink,Dolichonyx oryzivorus,Sturnella neglecta -- Western Meadowlark,Sharon J,2021-10-03,2021,10,3,1336,United States,US-CA-075,California,San Francisco,Presidio--Crissy Field,37.8041273,-122.4642633,"",,Unspecified,"","",,,,,,,S95559303,"",,,,"Continuing, found by Brian Fitch on the first. Like if a WEME and WCSP somehow had a baby. Generally light brown and streaky above, yellow-buff breast and supercilium, strong crown stripes, white in center, dark brown super-supercilium and post-ocular line. Short (like cowbird) pinkish bill. Much smaller than WEME it was associating with. Did not show white outer tail feathers in flight. Flock flushed repeatedly, but eventually decently seen 37.803586,-122.462309",Dolichonyx oryzivorus,boboli,Species,32470,,2.00,1,,1126,1600
374782391,Photo,Canada Warbler,Cardellina canadensis,,Sharon J,2021-10-03,2021,10,3,1145,United States,US-CA-075,California,San Francisco,Presidio--Dragonfly Creek ,37.8000016,-122.4722815,"",,Unspecified,"","",,,,,,,S95553374,"",,,,"Continuing. White vent, grey back and head yellow belly, throat and lores, dark necklace, white eyering, pink legs.",Cardellina canadensis,canwar,Species,33215,,2.00,1,,1080,1600
374782381,Photo,Canada Warbler,Cardellina canadensis,,Sharon J,2021-10-03,2021,10,3,1145,United States,US-CA-075,California,San Francisco,Presidio--Dragonfly Creek ,37.8000016,-122.4722815,"",Flying,Unspecified,"","",,,,,,,S95553374,"",,,,"Continuing. White vent, grey back and head yellow belly, throat and lores, dark necklace, white eyering, pink legs.",Cardellina canadensis,canwar,Species,33215,,2.00,1,"",1031,1600
374780361,Photo,Black-throated Blue Warbler,Setophaga caerulescens,,Sharon J,2021-10-03,2021,10,3,820,United States,US-CA-075,California,San Francisco,Golden Gate Park--San Francisco Botanical Garden,37.7675937,-122.4688053,Male – 1,,Unspecified,"","",,,,,,,S95543830,"",,,,"Seen 10:05 in camelias near moon viewing garden pond. Flycatching actively low in understory chipping frequently. White belly, dark blue hood and back, black mask and bib, black wings with tiny white kerchief patch at base of primaries. Amazing find by Nina Bai yesterday.",Setophaga caerulescens,btbwar,Species,33023,,2.00,1,,1248,1600
374780351,Photo,Black-throated Blue Warbler,Setophaga caerulescens,,Sharon J,2021-10-03,2021,10,3,820,United States,US-CA-075,California,San Francisco,Golden Gate Park--San Francisco Botanical Garden,37.7675937,-122.4688053,Male – 1,,Unspecified,"","",,,,,,,S95543830,"",,,,"Seen 10:05 in camelias near moon viewing garden pond. Flycatching actively low in understory chipping frequently. White belly, dark blue hood and back, black mask and bib, black wings with tiny white kerchief patch at base of primaries. Amazing find by Nina Bai yesterday.",Setophaga caerulescens,btbwar,Species,33023,,2.00,1,,1220,1600
371933511,Photo,Least Sandpiper,Calidris minutilla,Arenaria melanocephala -- Black Turnstone,Sharon J,2021-09-23,2021,9,23,1301,United States,US-CA-001,California,Alameda,John Sutter Regional Park,37.8210431,-122.3277332,"",,Unspecified,"","",,,,,,,S95069877,"",,,,,Calidris minutilla,leasan,Species,5948,,2.00,1,,997,1600
371186401,Photo,Willow Flycatcher,Empidonax traillii,,Sharon J,2021-09-20,2021,9,20,1141,United States,US-CA-001,California,Alameda,Emeryville Marina,37.8393943,-122.3118854,"",,Unspecified,"","",,,,,,,S94944793,"",,,,"Think it's willow: large bill, wide orange lower mandible, darker and duller than typical Pac-slope, no vest, dull tan wingbars, not much eyering.",Empidonax traillii,wilfly,Species,16285,,2.00,1,,1121,1600
371186321,Photo,Wandering Tattler,Tringa incana,Calidris minutilla -- Least Sandpiper,Sharon J,2021-09-20,2021,9,20,1141,United States,US-CA-001,California,Alameda,Emeryville Marina,37.8393943,-122.3118854,"",,Unspecified,"","",,,,,,,S94944793,"",,,,,Tringa incana,wantat1,Species,6033,,2.00,1,,1227,1600
371186311,Photo,Wandering Tattler,Tringa incana,,Sharon J,2021-09-20,2021,9,20,1141,United States,US-CA-001,California,Alameda,Emeryville Marina,37.8393943,-122.3118854,"",,Unspecified,"","",,,,,,,S94944793,"",,,,,Tringa incana,wantat1,Species,6033,,2.00,1,,1224,1600
370050731,Photo,Pectoral Sandpiper,Calidris melanotos,"Calidris minutilla -- Least Sandpiper; Charadrius semipalmatus -- Semipalmated Plover",Sharon J,2021-09-16,2021,9,16,1159,United States,US-CA-001,California,Alameda,Albany Mudflats,37.8923310,-122.3117995,"",,Unspecified,"","",,,,,,,S94748494,"",,,,"Almost 2x taller than LESA, yellow legs, streaked buff chest panel sharply demarcated from white belly. Bill roughly head length, slightly drooped, stout at base. Couldn't make out yellow on bill in field due to overcast conditions, but visible once underexposed photos lightened at home. Rather golden cast and scaly back. Seen briefly adjacent to LESA at spur near willow thicket, flew north and I lost sight.",Calidris melanotos,pecsan,Species,5953,,2.00,1,,1007,1600
370050711,Photo,Pectoral Sandpiper,Calidris melanotos,Calidris minutilla -- Least Sandpiper,Sharon J,2021-09-16,2021,9,16,1159,United States,US-CA-001,California,Alameda,Albany Mudflats,37.8923310,-122.3117995,"",,Unspecified,"","",,,,,,,S94748494,"",,,,"Almost 2x taller than LESA, yellow legs, streaked buff chest panel sharply demarcated from white belly. Bill roughly head length, slightly drooped, stout at base. Couldn't make out yellow on bill in field due to overcast conditions, but visible once underexposed photos lightened at home. Rather golden cast and scaly back. Seen briefly adjacent to LESA at spur near willow thicket, flew north and I lost sight.",Calidris melanotos,pecsan,Species,5953,,2.00,1,,1077,1600
368324021,Photo,Orange-crowned Warbler,Leiothlypis celata,,Sharon J,2021-09-10,2021,9,10,1202,United States,US-CA-001,California,Alameda,Creekside Park (ALA Co.),37.8979879,-122.3040480,"",,Unspecified,"","",,,,,,,S94471431,"",,,,,Leiothlypis celata,orcwar,Species,32870,,2.00,1,,1144,1600
368320911,Photo,Yellow Warbler,Setophaga petechia,,Sharon J,2021-09-10,2021,9,10,1202,United States,US-CA-001,California,Alameda,Creekside Park (ALA Co.),37.8979879,-122.3040480,"",,Unspecified,"","",,,,,,,S94471431,"",,,,,Setophaga petechia,yelwar,Species,32976,,2.00,1,,1151,1600
368108501,Photo,"Townsend's Warbler",Setophaga townsendi,,Sharon J,2021-09-09,2021,9,9,1229,United States,US-CA-013,California,Contra Costa,Wildcat Canyon Regional Park,37.9394931,-122.2982168,"",,Unspecified,"","",,,,,,,S94433254,"",,,,,Setophaga townsendi,towwar,Species,33080,,2.00,1,,1178,1600
367804401,Photo,hummingbird sp.,Trochilidae sp.,,Sharon J,2021-09-08,2021,9,8,1154,United States,US-CA-001,California,Alameda,Creekside Park (ALA Co.),37.8979879,-122.3040480,"",,Unspecified,"","",,,,,,,S94386607,"",,,,"I'm thinking of writing a book on all the ways Anna's hummingbirds have fooled me. This one will get indexed both under ""white belly"" and ""narrower inner (web of inner) primaries""",Trochilidae sp.,hummin,Spuh,5085,,2.00,1,,1091,1600
367598571,Photo,Willow Flycatcher,Empidonax traillii,,Sharon J,2021-09-07,2021,9,7,1351,United States,US-CA-001,California,Alameda,Emeryville Marina,37.8393943,-122.3118854,"",,Unspecified,"","",,,,,,,S94345710,"",,,,In coyote brush east of fire station,Empidonax traillii,wilfly,Species,16285,,2.00,1,,1161,1600
367593151,Photo,gull sp.,Larinae sp.,,Sharon J,2021-09-07,2021,9,7,1351,United States,US-CA-001,California,Alameda,Emeryville Marina,37.8393943,-122.3118854,"",,Unspecified,"","",,,,,,,S94345710,"",,,,,Larinae sp.,larus,Spuh,6409,,2.00,1,,1097,1600
367593141,Photo,gull sp.,Larinae sp.,,Sharon J,2021-09-07,2021,9,7,1351,United States,US-CA-001,California,Alameda,Emeryville Marina,37.8393943,-122.3118854,"",,Unspecified,"","",,,,,,,S94345710,"",,,,,Larinae sp.,larus,Spuh,6409,,2.00,1,,1073,1600
367593131,Photo,gull sp.,Larinae sp.,,Sharon J,2021-09-07,2021,9,7,1351,United States,US-CA-001,California,Alameda,Emeryville Marina,37.8393943,-122.3118854,"",,Unspecified,"","",,,,,,,S94345710,"",,,,,Larinae sp.,larus,Spuh,6409,,2.00,1,,999,1600
367286791,Photo,Northern Fulmar,Fulmarus glacialis,,Sharon J,2021-09-06,2021,9,6,1240,United States,US-CA-001,California,Alameda,Gilman St. waterfront,37.8778939,-122.3097638,"",Molting,Unspecified,"","",,,,,,,S94295181,"",,,,"Pale gull-sized bird with terrible feathers (though molting in a few new ones), probably juvenile. Obvious tubenose. Photos. Found by Alex Henry. Drifted to shore, beached itself. Taken to International Bird Rescue* in Fairfield. Still alive on delivery.  *beached pelagic birds such as alcids and tubenoses are often in trouble. IBRRC is the best-equipped of our local rescue centers to help aquatic birds. Their contract info is: https://www.birdrescue.org/contact/found-a-bird/helping-a-debilitated-bird/  Found an aquatic bird? Call and let us know: International Bird Rescue San Francisco Bay Center 4369 Cordelia Road Fairfield, California 94534  Call our Northern California Bird HelpLine at 707.207.0380   Extension 110  Hours: 8:00 a.m. – 5:00 p.m.",Fulmarus glacialis,norful,Species,6758,,2.00,1,"",1123,1600
367284421,Photo,Red-necked Phalarope,Phalaropus lobatus,Calidris mauri -- Western Sandpiper,Sharon J,2021-09-06,2021,9,6,1240,United States,US-CA-001,California,Alameda,Gilman St. waterfront,37.8778939,-122.3097638,Juvenile – 1,,Unspecified,"","",,,,,,,S94295181,"",,,,,Phalaropus lobatus,renpha,Species,6021,,2.00,1,,1076,1600
366588201,Photo,"Baird's Sandpiper",Calidris bairdii,"Sturnus vulgaris -- European Starling; Agelaius phoeniceus -- Red-winged Blackbird; Calidris minutilla -- Least Sandpiper",Sharon J,2021-09-04,2021,9,4,1104,United States,US-CA-001,California,Alameda,Don Edwards NWR--No Name Trail,37.5464008,-122.0973837,"",,Unspecified,"","",,,,,,,S94179115,"",,,,Two together and one opposite end of foam mat,Calidris bairdii,baisan,Species,5945,,2.00,1,,1067,1600
366585391,Photo,"Baird's Sandpiper",Calidris bairdii,Calidris minutilla -- Least Sandpiper,Sharon J,2021-09-04,2021,9,4,1104,United States,US-CA-001,California,Alameda,Don Edwards NWR--No Name Trail,37.5464008,-122.0973837,"",,Unspecified,"","",,,,,,,S94179115,"",,,,Two together and one opposite end of foam mat,Calidris bairdii,baisan,Species,5945,,2.00,1,,1117,1600
366583381,Photo,Semipalmated Sandpiper,Calidris pusilla,,Sharon J,2021-09-04,2021,9,4,1104,United States,US-CA-001,California,Alameda,Don Edwards NWR--No Name Trail,37.5464008,-122.0973837,"",,Unspecified,"","",,,,,,,S94179115,"",,,"suspect the one in front is Semipalmated Sandpiper - no red in scapulars, and bill appears straight and shorter than head. ","foraging actively on scum mat just west of boom/ pump station. Dark brown-grey on back and wings, no red as in juv WESA.  Bill significantly shorter than head with no droop. Narrows evenly without a fine point at the end. Also slightly smaller and rounder/more compact-looking than nearby Westerns.",Calidris pusilla,semsan,Species,5956,,2.00,1,,1902,2305
366583371,Photo,Semipalmated Sandpiper,Calidris pusilla,,Sharon J,2021-09-04,2021,9,4,1104,United States,US-CA-001,California,Alameda,Don Edwards NWR--No Name Trail,37.5464008,-122.0973837,"",,Unspecified,"","",,,,,,,S94179115,"",,,"suspect the one in front is Semipalmated Sandpiper - no red in scapulars, and bill appears straight and shorter than head. ","foraging actively on scum mat just west of boom/ pump station. Dark brown-grey on back and wings, no red as in juv WESA.  Bill significantly shorter than head with no droop. Narrows evenly without a fine point at the end. Also slightly smaller and rounder/more compact-looking than nearby Westerns.",Calidris pusilla,semsan,Species,5956,,2.00,1,,1871,2034
366583341,Photo,Semipalmated Sandpiper,Calidris pusilla,,Sharon J,2021-09-04,2021,9,4,1104,United States,US-CA-001,California,Alameda,Don Edwards NWR--No Name Trail,37.5464008,-122.0973837,Juvenile – 1,,Unspecified,"","",,,,,,,S94179115,"",,,"suspect this one is Semipalmated Sandpiper - no red in scapulars, and bill appears straight and shorter than head. ","foraging actively on scum mat just west of boom/ pump station. Dark brown-grey on back and wings, no red as in juv WESA.  Bill significantly shorter than head with no droop. Narrows evenly without a fine point at the end. Also slightly smaller and rounder/more compact-looking than nearby Westerns.",Calidris pusilla,semsan,Species,5956,,2.00,1,,722,1095
365903331,Photo,Short-billed/Long-billed Dowitcher,Limnodromus griseus/scolopaceus,Calidris minutilla -- Least Sandpiper,Sharon J,2021-09-01,2021,9,1,1222,United States,US-CA-001,California,Alameda,Elsie Roemer Bird Sanctuary,37.7525975,-122.2473836,"",,Unspecified,"","",,,,,,,S94051258,"",,,lighter patagium seems to point towards LB,,Limnodromus griseus/scolopaceus,dowitc,Slash,5967,,2.00,1,,1261,1600
365902571,Photo,Short-billed/Long-billed Dowitcher,Limnodromus griseus/scolopaceus,"Calidris sp. (peep sp.) -- peep sp.; Calidris mauri -- Western Sandpiper",Sharon J,2021-09-01,2021,9,1,1222,United States,US-CA-001,California,Alameda,Elsie Roemer Bird Sanctuary,37.7525975,-122.2473836,"",,Unspecified,"","",,,,,,,S94051258,"",,,,,Limnodromus griseus/scolopaceus,dowitc,Slash,5967,,2.00,1,,1158,1600
365879841,Photo,Wandering Tattler,Tringa incana,,Sharon J,2021-09-01,2021,9,1,1222,United States,US-CA-001,California,Alameda,Elsie Roemer Bird Sanctuary,37.7525975,-122.2473836,"",,Unspecified,"","",,,,,,,S94051258,"",,,,"Tringa shaped, dowitcher size. Initially spotted near main viewing platform, later refound close to seawall.",Tringa incana,wantat1,Species,6033,,2.00,1,,1097,1600
365614261,Photo,hummingbird sp.,Trochilidae sp.,,Sharon J,2021-08-31,2021,8,31,1823,United States,US-CA-001,California,Alameda,South Berkeley residential,37.8600606,-122.2629882,"","Flying; Foraging or Eating",Unspecified,"","",,,,,,,S94016594,"",,,,"probably a female hatch-year Anna's. Lack of color perhaps due to inability to preen, or to nutritional deficiencies due to damaged bill. Still quite active and able to feed. See also https://ebird.org/checklist/S93645449",Trochilidae sp.,hummin,Spuh,5085,,2.00,1,"",1108,1600
365614251,Photo,hummingbird sp.,Trochilidae sp.,,Sharon J,2021-08-31,2021,8,31,1823,United States,US-CA-001,California,Alameda,South Berkeley residential,37.8600606,-122.2629882,"","Flying; Foraging or Eating",Unspecified,"","",,,,,,,S94016594,"",,,,"probably a female hatch-year Anna's. Lack of color perhaps due to inability to preen, or to nutritional deficiencies due to damaged bill. Still quite active and able to feed. See also https://ebird.org/checklist/S93645449",Trochilidae sp.,hummin,Spuh,5085,,2.00,1,"",1178,1600
365614211,Photo,hummingbird sp.,Trochilidae sp.,,Sharon J,2021-08-31,2021,8,31,1823,United States,US-CA-001,California,Alameda,South Berkeley residential,37.8600606,-122.2629882,"",,Unspecified,"","",,,,,,,S94016594,"",,,,"probably a female hatch-year Anna's. Lack of color perhaps due to inability to preen, or to nutritional deficiencies due to damaged bill. Still quite active and able to feed. See also https://ebird.org/checklist/S93645449",Trochilidae sp.,hummin,Spuh,5085,,2.00,1,,1117,1600
365608131,Photo,Red-necked Phalarope,Phalaropus lobatus,,Sharon J,2021-08-31,2021,8,31,1641,United States,US-CA-001,California,Alameda,Sea Breeze Market Cove,37.8654693,-122.3065209,Juvenile – 1,,Unspecified,"","",,,,,,,S94009980,"",,,,,Phalaropus lobatus,renpha,Species,6021,,2.00,1,,1044,1600
364473071,Photo,hummingbird sp.,Trochilidae sp.,,Sharon J,2021-08-27,2021,8,27,1217,United States,US-CA-001,California,Alameda,Lake Elizabeth,37.5478778,-121.9604301,"",,Unspecified,"","",,,,,,,S93811563,"",,,,"another for my collection of weird-looking female anna's, i guess.",Trochilidae sp.,hummin,Spuh,5085,,2.00,1,,1037,1600
364467761,Photo,Common Yellowthroat,Geothlypis trichas,,Sharon J,2021-08-27,2021,8,27,1217,United States,US-CA-001,California,Alameda,Lake Elizabeth,37.5478778,-121.9604301,Immature Male – 1,,Unspecified,"","",,,,,,,S93811563,"",,,,,Geothlypis trichas,comyel,Species,32921,,2.00,1,,1094,1600
364467701,Photo,Scaly-breasted Munia,Lonchura punctulata,,Sharon J,2021-08-27,2021,8,27,1217,United States,US-CA-001,California,Alameda,Lake Elizabeth,37.5478778,-121.9604301,"",,Unspecified,"","",,,,,,,S93811563,"",,,,Continuing by bridge/golf course. Photos obtained showing nutmeg-colored head and white chest with dark scale outlines,Lonchura punctulata,nutman,Species,30045,,2.00,1,,1075,1600
364204361,Photo,Least Sandpiper,Calidris minutilla,,Sharon J,2021-08-25,2021,8,25,1535,United States,US-CA-001,California,Alameda,Don Edwards NWR--No Name Trail,37.5464008,-122.0973837,"",,Unspecified,"","",,,,,,,S93734417,"",,,"same as ML364204271. oddly pale and gray. compare to ""normal"" LESA",,Calidris minutilla,leasan,Species,5948,,2.00,1,,1053,1600
364204271,Photo,Least Sandpiper,Calidris minutilla,,Sharon J,2021-08-25,2021,8,25,1535,United States,US-CA-001,California,Alameda,Don Edwards NWR--No Name Trail,37.5464008,-122.0973837,"",,Unspecified,"","",,,,,,,S93734417,"",,,Same as 364204361. oddly pale and frosty-looking.,,Calidris minutilla,leasan,Species,5948,,2.00,1,,1066,1600
364202811,Photo,Least Sandpiper,Calidris minutilla,,Sharon J,2021-08-25,2021,8,25,1535,United States,US-CA-001,California,Alameda,Don Edwards NWR--No Name Trail,37.5464008,-122.0973837,"",,Unspecified,"","",,,,,,,S93734417,"",,,,,Calidris minutilla,leasan,Species,5948,,2.00,1,,1076,1600
364202771,Photo,peep sp.,Calidris sp. (peep sp.),,Sharon J,2021-08-25,2021,8,25,1535,United States,US-CA-001,California,Alameda,Don Edwards NWR--No Name Trail,37.5464008,-122.0973837,"",,Unspecified,"","",,,,,,,S93734417,"",,,"upper right bird has a different wing pattern, though maybe that's just wear/molt. ",,Calidris sp. (peep sp.),calidr,Spuh,5959,,2.00,1,,1049,1600
363291141,Photo,"Townsend's Warbler",Setophaga townsendi,,Sharon J,2021-08-22,2021,8,22,1455,United States,US-CA-001,California,Alameda,Upper Claremont Canyon--UC Preserve,37.8697211,-122.2229433,"",,Unspecified,"","",,,,,,,S93615643,"",,,,"completely yellow throat seems to indicated 1st year female, though otherwise looks pretty crisp and contrasty.",Setophaga townsendi,towwar,Species,33080,,2.00,1,,1076,1600
362980711,Photo,Rose-breasted Grosbeak,Pheucticus ludovicianus,,Sharon J,2021-08-21,2021,8,21,1424,United States,US-CA-001,California,Alameda,UC Berkeley--Fire Trail,37.8741081,-122.2283936,"",,Unspecified,"","",,,,,,,S93559168,"",,,,"Ad male 37.873311,-122.225184 seen from back, very black with white underparts and patches on wings. Fully black head and stout bill. Later respotted and red breast patch seen. Poor photos. Seems to be keeping company with bird that looks more like typical female/immature bhgr maybe pair?",Pheucticus ludovicianus,robgro,Species,33424,,2.00,1,,1161,1600
362285151,Photo,peep sp.,Calidris sp. (peep sp.),Calidris minutilla -- Least Sandpiper,Sharon J,2021-08-18,2021,8,18,1437,United States,US-CA-001,California,Alameda,Albany Mudflats,37.8923310,-122.3117995,"",Foraging or Eating,Unspecified,"","",,,,,,,S93424158,"",,,,"Most just too far away. One stuck out as odd; presumably Western, but showing much more ruddy in the throat/upper breast than I'd expect. I think buff/unspotted indicates juvenile, but they should also show more of a red ""V"" on their back, I think.",Calidris sp. (peep sp.),calidr,Spuh,5903,,2.00,1,"",1279,1600
362249161,Photo,peep sp.,Calidris sp. (peep sp.),,Sharon J,2021-08-18,2021,8,18,1437,United States,US-CA-001,California,Alameda,Albany Mudflats,37.8923310,-122.3117995,"",,Unspecified,"","",,,,,,,S93424158,"",,,,"Most just too far away. One stuck out as odd; presumably Western, but showing much more ruddy in the throat/upper breast than I'd expect. I think buff/unspotted indicates juvenile, but they should also show more of a red ""V"" on their back, I think.",Calidris sp. (peep sp.),calidr,Spuh,5903,,2.00,1,,903,1600
362249151,Photo,peep sp.,Calidris sp. (peep sp.),Calidris minutilla -- Least Sandpiper,Sharon J,2021-08-18,2021,8,18,1437,United States,US-CA-001,California,Alameda,Albany Mudflats,37.8923310,-122.3117995,"",Foraging or Eating,Unspecified,"","",,,,,,,S93424158,"",,,,"Most just too far away. One stuck out as odd; presumably Western, but showing much more ruddy in the throat/upper breast than I'd expect. I think buff/unspotted indicates juvenile, but they should also show more of a red ""V"" on their back, I think.",Calidris sp. (peep sp.),calidr,Spuh,5903,,2.00,1,"",1110,1600
362249131,Photo,peep sp.,Calidris sp. (peep sp.),,Sharon J,2021-08-18,2021,8,18,1437,United States,US-CA-001,California,Alameda,Albany Mudflats,37.8923310,-122.3117995,"",Foraging or Eating,Unspecified,"","",,,,,,,S93424158,"",,,,"Most just too far away. One stuck out as odd; presumably Western, but showing much more ruddy in the throat/upper breast than I'd expect. I think buff/unspotted indicates juvenile, but they should also show more of a red ""V"" on their back, I think.",Calidris sp. (peep sp.),calidr,Spuh,5903,,2.00,1,"",1113,1600
362249121,Photo,peep sp.,Calidris sp. (peep sp.),Calidris minutilla -- Least Sandpiper,Sharon J,2021-08-18,2021,8,18,1437,United States,US-CA-001,California,Alameda,Albany Mudflats,37.8923310,-122.3117995,"",,Unspecified,"","",,,,,,,S93424158,"",,,,"Most just too far away. One stuck out as odd; presumably Western, but showing much more ruddy in the throat/upper breast than I'd expect. I think buff/unspotted indicates juvenile, but they should also show more of a red ""V"" on their back, I think.",Calidris sp. (peep sp.),calidr,Spuh,5903,,2.00,1,,1123,1600
359842811,Photo,Snowy Plover,Charadrius nivosus,"Calidris pusilla -- Semipalmated Sandpiper; Calidris mauri -- Western Sandpiper",Sharon J,2021-08-07,2021,8,7,1459,United States,US-CA-001,California,Alameda,"Hayward Regional Shoreline--Frank's Dump",37.6540967,-122.1544504,Immature – 1,,Unspecified,"","",,,,,,,S92918802,"",,,,"In divots in mud. Not all distinguishable from golf balls, so probably undercount. I counted 43 individuals that were clearly birds, but lots more bird-shaped white balls. Saw two babies; doubled cotton balls with legs.",Charadrius nivosus,snoplo5,Species,5707,,2.00,1,,1199,1600
359842691,Photo,Snowy Plover,Charadrius nivosus,,Sharon J,2021-08-07,2021,8,7,1459,United States,US-CA-001,California,Alameda,"Hayward Regional Shoreline--Frank's Dump",37.6540967,-122.1544504,Unknown – 9,"",Unspecified,"","",,,,,,,S92918802,"",,,,"In divots in mud. Not all distinguishable from golf balls, so probably undercount. I counted 43 individuals that were clearly birds, but lots more bird-shaped white balls. Saw two babies; doubled cotton balls with legs.",Charadrius nivosus,snoplo5,Species,5707,,2.00,1,Habitat,1128,1600
359842671,Photo,Snowy Plover,Charadrius nivosus,,Sharon J,2021-08-07,2021,8,7,1459,United States,US-CA-001,California,Alameda,"Hayward Regional Shoreline--Frank's Dump",37.6540967,-122.1544504,Unknown – 16,"",Unspecified,"","",,,,,,,S92918802,"",,,,"In divots in mud. Not all distinguishable from golf balls, so probably undercount. I counted 43 individuals that were clearly birds, but lots more bird-shaped white balls. Saw two babies; doubled cotton balls with legs.",Charadrius nivosus,snoplo5,Species,5707,,2.00,1,Habitat,1036,1600
359736581,Photo,Lesser Yellowlegs,Tringa flavipes,,Sharon J,2021-08-07,2021,8,7,1459,United States,US-CA-001,California,Alameda,"Hayward Regional Shoreline--Frank's Dump",37.6540967,-122.1544504,"",,Unspecified,"","",,,,,,,S92918802,"",,,,"Photos, simultaneous on sulphur creek side of flat. Size compared to phalaropes",Tringa flavipes,lesyel,Species,5987,,2.00,1,,1099,1600
359736571,Photo,Lesser Yellowlegs,Tringa flavipes,,Sharon J,2021-08-07,2021,8,7,1459,United States,US-CA-001,California,Alameda,"Hayward Regional Shoreline--Frank's Dump",37.6540967,-122.1544504,"",,Unspecified,"","",,,,,,,S92918802,"",,,,"Photos, simultaneous on sulphur creek side of flat. Size compared to phalaropes",Tringa flavipes,lesyel,Species,5987,,2.00,1,,1166,1600
359464001,Photo,Song Sparrow,Melospiza melodia,,Sharon J,2021-08-06,2021,8,6,1220,United States,US-CA-001,California,Alameda,South Berkeley residential,37.8600606,-122.2629882,Juvenile – 1,,Unspecified,"","",,,,,,,S92853082,"",,,The only shot I was able to get (this time around) showing the extensive rufous on wings and tail.,"I believe this is the offspring of the birds that frequented our feeder over the winter. Their territory seems to be about a block SE of here. saw this one for the first time this morning in the company of numerous juncos, several of which also looked young. This bird has already mastered the mealworm feeder and the bathtub.",Melospiza melodia,sonspa,Species,32187,,2.00,1,,1117,1600
359246731,Photo,Red-breasted Nuthatch,Sitta canadensis,,Sharon J,2021-08-05,2021,8,5,1109,United States,US-CA-001,California,Alameda,UC Berkeley--Fire Trail,37.8741081,-122.2283936,"",,Unspecified,"","",,,,,,,S92815920,"",,,,,Sitta canadensis,rebnut,Species,25870,,2.00,1,,1036,1600
